9779,CENTRO EDUCACIONAL SANTA ROSA,13109,2,-33.53483086,-70.6544089,580,1,310
9780,COLEGIO TENIENTE DAGOBERTO GODOY,13105,2,-33.5597464,-70.65811107,1225,1,10
9781,CENTRO POLITECNICO PARTICULAR SAN RAMON,13109,2,-33.53942493,-70.65746279,1140,1,310
9784,LICEO TÉCNICO INDUSTRIAL LA CISTERNA,13109,2,-33.52882961,-70.6515616,231,1,310
9786,ROSA MARCKMANN DE GONZALEZ,13109,2,-33.53479157,-70.65645729,712,1,10
9788,ESCUELA PARTICULAR GRACIELA L.DE IBANEZ,13109,2,-33.5391701,-70.66773135,477,1,10
9789,ESCUELA PARTICULAR PABLO GOYENECHE IVER,13109,2,-33.53531386,-70.66809618,146,1,110
9796,ESC. PART.ADVENTISTA BUENAVENTURA,13116,2,-33.50569594,-70.69472345,868,1,10
9797,COLEGIO ADVENTISTA LA CISTERNA,13109,2,-33.53763485,-70.6682878,596,1,10
9799,COMPLEJO EDUC.PART.MONSENOR LUIS A.PEREZ,13121,2,-33.50108236,-70.68927348,2223,1,10
9800,ESCUELA BAS. ROSA ELVIRA MATTE DE PRIETO,13116,2,-33.50679897,-70.6926526,1212,1,10
9801,COLEGIO POLIV. SAINT ORLAND,13109,2,-33.52937619,-70.65171822,772,1,10
9803,ESCUELA PARTICULAR HISPANO AMERICANO,13105,2,-33.55158877,-70.67012862,403,1,10
9804,ESCUELA PABLO DE TARSO,13109,2,-33.51617502,-70.66734188,214,1,10
9805,ESCUELA PARTICULAR CAMPANITA,13105,2,-33.55942807,-70.66672459,353,1,10
9807,ESCUELA PARTICULAR LOCARNO,13109,2,-33.51794139999999,-70.66183225,123,1,110
9808,ESCUELA PARTICULAR GUIA ESTUDIANTIL,13109,2,-33.51833178999999,-70.65094544,322,1,10
9809,ESCUELA PARTICULAR SAINT PHILLIP OF NERY,13109,2,-33.53058251,-70.67452823,261,1,10
9810,LICEO POLITECNICO PART.SAGRADO CORAZON,13116,2,-33.51482345,-70.68008078,933,1,10
9811,ESCUELA PART. REPUBLICA ALEMANIA FEDERAL,13109,2,-33.53940233,-70.66693374,1669,1,10
9816,ESCUELA PARTICULAR STA.MARIA MAZZARELLO,13105,2,-33.54918004999999,-70.65532033,353,1,10
9817,COLEGIO PARTICULAR KENNEDY,13116,2,-33.53383924,-70.69819592,371,1,10
9824,COMPLEJO EDUCACIONAL STELLA MARIS,13105,2,-33.55693659,-70.67449999,942,1,10
9826,ESCUELA PARTICULAR LOS CAPULLITOS,13109,3,-33.52586264,-70.65564073,10,1,10
9827,COLEGIO IDOP LIMITADA,13109,2,-33.54318864999999,-70.66151495,1084,1,10
9828,COLEGIO SOL DE CHILE,13116,2,-33.52923641999999,-70.69734098,643,1,10
9829,COLEGIO MIGUEL DE CERVANTES,13109,2,-33.54412769999999,-70.6558275,623,1,310
9830,ESCUELA PARTICULAR SAN MARTIN DE PORRES,13109,2,-33.54554385,-70.66336312,132,1,110
9834,COLEGIO POLITEC. MARIA GRISELDA VALLE S.,13105,2,-33.5730656,-70.66467134,1960,1,10
9841,ESCUELA PARTICULAR MIGUEL DE CERVANTES,13105,2,-33.57872299999999,-70.67261962,826,1,10
9842,ESCUELA PARTICULAR NUESTRA INFANCIA,13116,2,-33.516804,-70.68309,13,1,10
9844,COLEGIO EL ALMENDRO,13105,2,-33.57619368,-70.66334217,951,1,10
9845,COLEGIO GRACE SCHOOL,13121,2,-33.50157888999999,-70.68742747,1027,1,10
9847,ESCUELA PARTICULAR KAROL C.DE CRACOVIA,13121,2,-33.50149347,-70.69304595,899,1,10
9850,ESCUELA PARTICULAR LOS LAGOS CHILE,13105,2,-33.54476588,-70.67765814,111,1,110
9852,ESCUELA PARTICULAR VILLA EL SOL,13105,2,-33.55477057,-70.67009858,1561,1,10
9853,COLEGIO POLIV. SAINT TRINITY COLLEGE,13116,2,-33.52988953,-70.69000169,540,1,10
9855,COLEGIO PRINCESS ANNE SCHOOL,13109,3,-33.520991,-70.66013,365,1,10
9859,COLEGIO PARTICULAR VILLA JESUS,13109,2,-33.52135358,-70.65553564,817,1,10
9860,LICEO BICENTENARIO INDUSTRIAL DE ELECTROTECNIA RAMON B,13109,4,-33.52119803,-70.65822211,759,1,310
9861,CENTRO EDUC.MUNIC. DR. AMADOR NECHME R.,13106,1,-33.47219812,-70.72080896,917,1,10
9862,LICEO BICENTENARIO POLIVALENTE A N°71 GUILLERMO FELIU CRUZ,13106,1,-33.46382006999999,-70.70144017,627,1,310
9863,LICEO SANTIAGO BUERAS Y AVARIA,13119,1,-33.50527427,-70.75174176,593,1,10
9864,LICEO JOSE IGNACIO ZENTENO,13119,1,-33.50340173,-70.76915488,581,1,10
9865,LICEO POLIVALENTE DR. LUIS VARGAS SALCEDO,13102,1,-33.49895871999999,-70.73097771,780,1,10
9866,LICEO COMERCIAL B-72,13106,4,-33.46422609999999,-70.70208185,629,1,310
9867,CENTRO DE EDUC. TECN.PROFESIONAL CODEDUC,13119,1,-33.50955924,-70.74725518,838,1,110
9869,ESCUELA BASICA REPUBLICA DE FRANCIA,13106,1,-33.47615978999999,-70.7108756,373,1,10
9870,ESCUELA BASICA CONDORES DE PLATA,13102,1,-33.49381185,-70.71815383,326,1,10
9872,ESCUELA BASICA PROF.RAMON DEL RIO,13106,1,-33.46603649,-70.70288555,357,1,10
9873,ESCUELA BASICA PACTO ANDINO,13106,1,-33.463514,-70.70920911,622,1,10
9874,ESCUELA LOTHAR KOMMER BRUGER,13102,1,-33.50690488,-70.73412556,291,1,10
9875,ESCUELA CERRILLOS,13102,1,-33.49396474,-70.71027254,463,1,10
9876,ESCUELA GENERAL SAN MARTIN,13119,1,-33.51040561,-70.76221241,532,1,10
9877,ESCUELA GENERAL OHIGGINS,13119,1,-33.50971551,-70.76308151,529,1,10
9878,ESCUELA PRESIDENTE RIESCO ERRAZURIZ,13119,1,-33.52620996999999,-70.75909153,743,1,10
9879,ESCUELA BASICA CAROLINA VERGARA AYARES,13106,1,-33.47361062,-70.70516895,493,1,10
9880,ESCUELA  BASICA  ESTADO  DE  PALESTINA,13106,1,-33.47358255999999,-70.70160736,343,1,10
9881,ESCUELA VICENTE REYES PALAZUELOS,13119,1,-33.51707669,-70.75083578,537,1,10
9882,ESCUELA J.PRIETO VIAL,13102,1,-33.50924638,-70.73827342,437,1,10
9883,ESCUELA BÁSICA N 263 RAMON FREIRE,13119,1,-33.49851434,-70.77111241,525,1,10
9884,ESCUELA LEON HUMBERTO VALENZUELA,13119,1,-33.49748334,-70.76528718,501,1,10
9886,ESCUELA ESTRELLA REINA DE CHILE,13102,1,-33.49982751999999,-70.72539113,291,1,10
9887,ESCUELA EL LLANO DE MAIPU,13119,1,-33.51665706,-70.75011595,142,1,110
9888,ESCUELA SANTA ADELA,13102,1,-33.50934752,-70.71648165,398,1,10
9889,LICEO REINO DE DINAMARCA,13119,1,-33.50718521,-70.78259673,577,1,10
9890,ESCUELA TOMAS VARGAS,13119,1,-33.49999901,-70.776254,484,1,10
9891,REPUBLICA DE GUATEMALA,13119,1,-33.49750189,-70.74955631,627,1,10
9892,ESCUELA LAS AMERICAS,13119,1,-33.54831043,-70.77296801,760,1,10
9893,ESCUELA ESPECIAL ANDALUE,13119,1,-33.51586,-70.767456,187,1,212
9895,ESCUELA BASICA REINA DE SUECIA,13119,1,-33.4736724,-70.75601668,597,1,10
9896,LICEO ALCALDE GONZALO PEREZ LLONA,13119,1,-33.51075376,-70.72421283,266,1,310
9897,LICEO POLITECNICO PARTICULAR HANNOVER,13119,2,-33.4994248,-70.74433865,1336,1,310
9900,COLEGIO BICENTENARIO DE EXCELENCIA POLITECNICO ALEMAN ALBERT EINSTEIN,13102,2,-33.49711154,-70.71937341,931,1,110
9901,ESCUELA PARTICULAR FRANZ LISZT,13119,2,-33.51605977,-70.76354117,327,1,10
9902,ESCUELA PARTICULAR ESPECIAL DON ORIONE,13102,2,-33.501175,-70.71658,53,1,212
9903,COLEGIO LOS CONQUISTADORES,13102,2,-33.50895698,-70.72668105,1112,1,10
9905,LICEO SAN PEDRO POVEDA,13119,2,-33.49613737,-70.76092139,499,1,110
9906,ESCUELA PARTICULAR INSTITUTO AMERICA,13119,2,-33.50788835,-70.7650068,659,1,10
9907,COLEGIO POLIVALENTE CAMILO HENRIQUEZ,13119,2,-33.51493608,-70.76275292,982,1,110
9909,CENTRO EDUCACIONAL PIAMARTINO CAROLINA LLONA DE CUEVAS,13119,2,-33.5151854,-70.7642677,2301,1,10
9910,COLEGIO PARTICULAR SAN FELIX,13119,2,-33.50031890999999,-70.75048348,386,1,110
9911,COLEGIO DE LA PROVIDENCIA C.LARRAIN DE I,13119,2,-33.51558253999999,-70.76593938,1151,1,10
9912,COLEGIO PART. ASCENSION NICOL,13106,2,-33.46874522,-70.69900695,848,1,110
9916,ESCUELA DE PARVULOS LOS PAISES BAJOS,13106,2,-33.45926,-70.7086,202,1,10
9917,COLEGIO POLIVALENTE PATRICIO MEKIS,13119,2,-33.51055005,-70.77584284,2084,1,10
9919,COLEGIO PARTICULAR MATER DEI,13102,2,-33.50068911999999,-70.71193514,769,1,10
9920,ESC. BASICA DIVINO JESUS,13119,2,-33.52654683,-70.76541655,171,1,110
9922,ESCUELA PARTICULAR HOLANDA,13106,2,-33.4680096,-70.72247585,799,1,10
9924,COLEGIO ALBERTO PEREZ,13119,2,-33.49969075,-70.75924528,1517,1,10
9926,COLEGIO SOFIA INFANTE HURTADO,13119,2,-33.52551514999999,-70.75779307,579,1,10
9928,ESCUELA PARTICULAR AMANECER,13106,2,-33.47107314,-70.72022276,77,1,110
9930,ESCUELA PARTICULAR JOSE ANTONIO LECAROS,13106,2,-33.46399696999999,-70.69880676,542,1,10
9937,LICEO MATER PURISSIMA,13119,2,-33.50517905,-70.74711759,902,1,10
9939,ESCUELA BASICA CAMPOS DE MAIPU-CERRILLOS,13102,2,-33.49900348,-70.72373738,972,1,10
9940,ESCUELA LICEO MADRE VICENCIA,13106,2,-33.46230697,-70.70896453,1175,1,110
9941,COLEGIO PARTICULAR DE ASIS,13119,3,-33.51102247,-70.76752034,293,1,10
9942,"ESCUELA, COLEGIO POLITEC.H.DE MAGALLANES",13106,2,-33.46914868999999,-70.71244689,525,1,10
9945,COLEGIO ELLEN COLLEGE,13119,2,-33.50405544,-70.7671735,379,1,10
9946,ESCUELA PARTICULAR LA MONTANA,13119,2,-33.52341083999999,-70.7629265,194,1,10
9947,COLEGIO INDUSTRIAL PART. DON ORIONE,13102,2,-33.50360544,-70.71201881,1620,1,110
9948,ESCUELA PARTICULAR SAINT RODRIC COLLEGE,13102,2,-33.50602268,-70.7252395,160,1,110
9950,COLEGIO EL REDENTOR,13119,2,-33.50309318,-70.76417605,759,1,10
9953,CENTRO EDUCACIONAL SAN ANDRES,13119,2,-33.48467347999999,-70.74793584,378,1,10
9955,COLEGIO ROSITA SANCHEZ,13119,2,-33.52667979,-70.77176413,472,1,110
9957,LICEO INDUSTRIAL ALBERTO WIDMER,13119,2,-33.50971455,-70.76739117,837,1,310
9959,COMPLEJO EDUCACIONAL MAIPU,13119,2,-33.5172332,-70.77519763,3421,1,10
9960,ESCUELA PARTICULAR VILLA ESPANA,13106,2,-33.46203451,-70.69947367,395,1,110
9963,COLEGIO PARTICULAR ESPECIAL JUAN XXIII,13102,2,-33.500835,-70.726006,209,1,212
9967,ESCUELA PARTICULAR RUBEN DARIO,13119,2,-33.51861359,-70.75718188,795,1,10
9968,ESCUELA ESPECIAL EDUCACIONAL AGAZZI,13119,2,-33.51471999999999,-70.761444,77,1,212
9972,ESC. BASICA PARTIC.SAINT MAURICES,13102,2,-33.50235159999999,-70.72849209,698,1,10
9973,COLEGIO SANTA URSULA,13119,2,-33.51117827,-70.75066356,591,1,10
9979,COLEGIO PETER COLLEGE,13102,2,-33.50262316,-70.72587956,320,1,10
9981,LICEO INDUSTRIAL DOMINGO MATTE PEREZ,13119,4,-33.51611178999999,-70.75420244,501,1,310
9982,LICEO COMERCIAL MOLINA LAVIN,13126,4,-33.43004782,-70.70916643,894,1,310
9985,LICEO GUILLERMO LABARCA HUBERTSON,13126,1,-33.44124725999999,-70.69895719,634,1,165
9986,LICEO POLITECNICO,13126,1,-33.42211541,-70.70144474,333,1,310
9987,ESCUELA PLATON,13126,1,-33.41153236,-70.7043935,295,1,10
9991,ESCUELA ABATE MOLINA,13126,1,-33.43114039999999,-70.70930196,341,1,10
9992,ESCUELA DIEGO PORTALES,13126,1,-33.42138778,-70.70182082,620,1,10
9993,ESCUELA INGLATERRA,13126,1,-33.44074133,-70.70375703,697,1,10
9994,ESCUELA ANGELMO,13126,1,-33.42854788,-70.71493232,380,1,10
9995,ESCUELA INSIGNE GABRIELA,13126,1,-33.43247311999999,-70.70930354,506,1,10
9996,ESCUELA ESPANA,13126,1,-33.41037726999999,-70.71122789,275,1,10
9998,ESCUELA LO FRANCO,13126,1,-33.42168257,-70.70081894,863,1,10
9999,ESCUELA ANTUMALAL,13126,1,-33.41819706999999,-70.71444995,277,1,10
10000,ESCUELA CALICANTO,13126,1,-33.42720742,-70.71011731,594,1,10
10001,ESCUELA MEMBRILLAR,13126,1,-33.43108676,-70.71913695,370,1,10
10005,ESCUELA BASICA MUNICIPAL GRENOBLE,13126,1,-33.42659534,-70.6954836,819,1,10
10006,ESCUELA REPUBLICA DE LA INDIA,13126,1,-33.44133926,-70.69829994,739,1,10
10010,MUSTAFA KEMAL ATATURK,13117,5,-33.43972749999999,-70.70999791,314,1,10
10012,ESCUELA GIL DE CASTRO,13126,1,-33.41222965,-70.71839974,210,1,10
10014,ESCUELA PARTICULAR ANDRES BELLO,13126,2,-33.44500196,-70.69434789,294,1,10
10015,ESCUELA OLGA NAVARRO SEPULVEDA,13126,2,-33.42598203,-70.70450426,981,1,10
10018,ESCUELA PARTICULAR JOSE JOAQUIN PEREZ,13126,2,-33.43158936999999,-70.69595927,174,1,10
10019,ESCUELA PARTICULAR SAN JOSE SCHOOL,13106,2,-33.45500441,-70.70421327,293,1,110
10021,ESCUELA PARTICULAR VICTOR HUGO,13126,2,-33.41640178,-70.69336905,338,1,10
10023,LICEO ALBERTO HURTADO,13126,2,-33.44721264999999,-70.6976603,473,1,110
10026,ESCUELA PARTICULAR MONTE GRANDE,13103,2,-33.43205397,-70.72081413,344,1,110
10028,ESCUELA N°1124 ALIANZA AMERICANA,13126,2,-33.43128054999999,-70.6902485,336,1,10
10030,LICEO POLIV.SAN JOSE DE LA PRECIOSA SANG,13126,2,-33.42921616999999,-70.71656416,2034,1,10
10032,ESCUELA BASICA PARTICULAR  Nº 488 `ZENON TORREALBA`,13126,2,-33.43391958,-70.69020642,437,1,10
10035,ESCUELA PARTICULAR NUEVO HORIZONTE,13126,2,-33.43139278999999,-70.7010933,293,1,10
10036,ESCUELA PARTICULAR PDTE. ABRAHAM LINCOLN,13126,2,-33.42991097,-70.71799853,651,1,10
10041,COLEGIO SAINT MARK,13126,2,-33.42571242,-70.71782084,294,1,10
10042,COLEGIO BICENTENARIO ELVIRA HURTADO DE MATTE DE SANTIAGO,13126,2,-33.42208002,-70.69608224,1241,1,10
10044,CENTRO EDUCACIONAL ALBERTO HURTADO,13126,2,-33.44784309,-70.69315919,751,1,310
10046,ESCUELA PARTICULAR SAGRADA FAMILIA,13126,2,-33.44709349,-70.69733204,547,1,10
10052,LICEO POLITECNICO SAN FRANCISCO SOLANO,13103,2,-33.43167002,-70.72136001,432,1,310
10056,ESCUELA DIFERENCIAL LOS LIRIOS,13126,2,-33.42244999999999,-70.69787,96,1,212
10058,COLEGIO POLIVALENTE PRINCIPE DE GALES,13106,2,-33.44955302,-70.69511693,1109,1,10
10063,ESCUELA PARTICULAR CARMEN CHACON,13126,2,-33.41428422,-70.71077632,190,1,10
10064,ESCUELA PARTICULAR MARIA CRISTINA,13126,2,-33.42473112999999,-70.71821266,297,1,10
10069,COLEGIO MARQUEL,13126,2,-33.44675062,-70.70159352,1476,1,10
10073,LICEO BICENTENARIO INDUSTRIAL VICENTE PEREZ ROSALES,13126,4,-33.43932469,-70.69851766,664,1,310
10074,ESCUELA ALIANZA,13103,5,-33.41458837999999,-70.76228048,212,1,10
10075,LICEO POLIVALENTE LOS HEROES DE LA CONCEPCIÓN,13103,5,-33.42281724,-70.74179704,325,1,310
10076,COMPLEJO EDUCACIONAL PEDRO PRADO,13117,5,-33.44430155,-70.72837157,950,1,10
10077,LICEO MUN. CENTRO EDUCACIONAL PUDAHUEL,13124,5,-33.44455765,-70.75031812,443,1,310
10080,ESCUELA TENIENTE HERNAN MERINO CORREA,13124,5,-33.43256326,-70.76105032,378,1,10
10081,ESCUELA ESTRELLA DE CHILE,13124,5,-33.43659884,-70.74768617,1185,1,10
10083,ESCUELA PRESIDENTE ROOSEVELT,13103,5,-33.4340388,-70.73817167,483,1,10
10085,ESCUELA ESTADO DE FLORIDA,13124,5,-33.43298071,-70.76666391,635,1,10
10086,ESCUELA REPUBLICA DE ITALIA,13103,5,-33.42661641,-70.73442201,265,1,10
10087,ESCUELA REPUBLICA DE CROACIA,13103,5,-33.43412811999999,-70.73019633,278,1,10
10088,ESCUELA HERMINDA DE LA VICTORIA,13103,5,-33.42472532,-70.73740401,252,1,10
10089,ESCUELA JAIME GOMEZ GARCIA,13117,5,-33.44252746,-70.71958863,580,1,10
10090,ESCUELA ALEXANDER GRAHAM BELL,13124,5,-33.43262897,-70.74151245,482,1,10
10091,ESCUELA PROFESORA GLADYS VALENZUELA V,13117,5,-33.44743503,-70.72679602,572,1,10
10092,ESCUELA GOLDA MEIR,13117,5,-33.45061901999999,-70.71809519,351,1,10
10093,ESCUELA MILLAHUE,13103,5,-33.419499,-70.74398051,293,1,10
10095,ESCUELA IGNACIO CARRERA PINTO,13117,5,-33.43726595999999,-70.7395033,185,1,10
10097,ESCUELA MARISCAL DE AYACUCHO,13117,5,-33.44094360999999,-70.7366367,212,1,10
10098,ESCUELA PROVINCIA DE ARAUCO,13103,5,-33.42355907,-70.71978877,259,1,10
10099,ESCUELA GENERAL RENE ESCAURIAZA,13103,5,-33.42559408,-70.74860244,291,1,10
10100,ESCUELA EL SALITRE,13124,5,-33.44797673,-70.75071456,260,1,10
10102,ESCUELA ALBERT EINSTEIN,13124,5,-33.43402154999999,-70.75469708,198,1,10
10103,ESCUELA SOR TERESA DE LOS ANDES,13117,5,-33.44421297,-70.73814775,570,1,10
10104,ESCUELA MONSENOR CARLOS OVIEDO,13124,5,-33.44976573999999,-70.7449827,305,1,10
10105,ESCUELA FEDERICO ACEVEDO SALAZAR,13103,5,-33.42075718,-70.75495826,525,1,10
10106,LICEO BICENTENARIO POETA PABLO NERUDA,13117,5,-33.45513941,-70.71492292,807,1,10
10107,ESCUELA BASICA PAULO FREIRE,13103,5,-33.41771764,-70.72486933,271,1,10
10108,ESCUELA LEONARDO DA VINCI,13103,5,-33.4275072,-70.74387558,259,1,10
10109,ESCUELA DOCTOR TREVISO GIRARDI TONELLI,13103,5,-33.42046717,-70.72875941,250,1,10
10113,ESCUELA ELVIRA SANTA CRUZ OSSA,13124,5,-33.44252952,-70.76542785,467,1,10
10114,ESCUELA BASICA N°389 REPUBLICA DE ESTADOS UNIDOS,13117,5,-33.44472809,-70.71438986,399,1,10
10116,COLEGIO NEPTUNO,13103,5,-33.43533682999999,-70.72778904,459,1,10
10117,ESCUELA MARIA LUISA BOMBAL,13103,5,-33.41511572999999,-70.73662856,271,1,10
10119,ESCUELA POETA VICENTE HUIDOBRO,13117,5,-33.45128328,-70.73558746,433,1,10
10120,LICEO DE ADULTOS ALBERTO GALLEGUILLOS J.,13124,5,-33.442444,-70.75491,315,1,363
10121,ESCUELA CIUDAD SANTO DOMINGO DE GUZMAN,13103,5,-33.43057297,-70.72993368,194,1,10
10122,ESCUELA PROF. MANUEL GUERRERO CEBALLOS,13103,5,-33.41365608,-70.75287839,450,1,10
10123,ESCUELA BASICA MELVIN JONES,13124,5,-33.44334781,-70.74194066,457,1,10
10124,ESCUELA SAN DANIEL,13124,5,-33.42875576,-70.76487576,381,1,10
10125,ESCUELA SARGENTO CANDELARIA,13103,5,-33.42543238999999,-70.7417655,204,1,10
10126,COMPLEJO EDUCACIONAL CERRO NAVIA,13103,5,-33.41412712,-70.7248779,332,1,10
10127,ESC.DE EDUCACION DIFERENCIAL QUILLAHUE,13117,5,-33.449547,-70.7274,151,1,212
10128,ESCUELA CENTRO EDUC.INTEGRAL DE ADULTOS,13117,5,-33.437267,-70.74014,479,1,165
10130,LICEO CIUDAD DE BRASILIA,13124,5,-33.40274066,-70.85564753,490,1,10
10133,ESCUELA BASICA G-N°320 LIPANGUE,13302,1,-33.33643357999999,-70.85672157,65,1,110
10134,ESC.COMODORO ARTURO MERINO BENITEZ,13124,5,-33.411774,-70.85475,372,1,10
10135,ESCUELA LO BOZA,13124,5,-33.38544646999999,-70.76167596,267,1,10
10140,ESCUELA PARTICULAR FRINGS COLLEGE,13117,2,-33.45381458,-70.70763408,456,1,10
10142,ESCUELA BASICA PARTICULAR N°811 DRA.VICTORIA GARCIA,13117,2,-33.45107809,-70.7301775,180,1,10
10143,ESCUELA PARTICULAR ESPANA,13103,2,-33.41925840999999,-70.72857503,303,1,10
10147,ESCUELA PARTICULAR BABILONIA,13117,2,-33.4484815,-70.71964465,426,1,10
10149,ESCUELA PARTICULAR RAPA NUI,13117,2,-33.44071093,-70.73078453,385,1,10
10151,COLEGIO CRISTIAN AND CAREN SCHOOL,13103,2,-33.42161093,-70.71961688,681,1,10
10152,ESCUELA PARTICULAR ANDANTINO,13124,2,-33.44331179999999,-70.7557482,447,1,10
10155,ESCUELA CHARLES SCHOOL-DIURNA,13103,2,-33.4332024,-70.7302413,319,1,10
10156,ESCUELA JARDIN LO PRADO,13117,2,-33.43710577,-70.73202624,379,1,10
10157,COLEGIO MINISTRO DIEGO PORTALES,13124,2,-33.44464675999999,-70.75041335,665,1,10
10158,COLEGIO BICENTENARIO SAN DAMIAN DE MOLOKAI,13103,2,-33.43007895,-70.73796488,1094,1,10
10159,ESCUELA PARTICULAR ROBERT KENNEDY,13103,2,-33.42890672,-70.73414133,326,1,10
10160,ESCUELA BAS. COLEGIO BAU,13117,2,-33.44943378,-70.73072933,822,1,10
10162,LICEO TENIENTE DAGOBERTO GODOY NO.3,13117,2,-33.45109149,-70.71388424,1708,1,10
10164,COLEGIO SAN FRANCISCO JAVIER,13103,2,-33.42134178,-70.72667173,1020,1,10
10167,ESCUELA BASICA N°1058 SANTA BEATRIZ,13124,2,-33.43862948999999,-70.75242894,734,1,10
10168,ESCUELA PARTICULAR SAN VICENTE FERRER,13103,2,-33.41379214,-70.7449497,758,1,10
10171,ESCUELA PARTICULAR VILLA LOURDES,13117,2,-33.4523,-70.73445,601,1,10
10172,ESC BAS PART CENTRO EDUCACIONAL SN PABLO,13103,2,-33.42456568,-70.73472539,354,1,10
10173,ESCUELA PART. SUNS SCHOOL,13124,2,-33.42892856999999,-70.76651827,239,1,10
10176,ESCUELA PARTICULAR ESPECIAL RENACER,13117,2,-33.445087,-70.7162,79,1,212
10182,ESCUELA  BASICA  N° 912 ELLEN  COLLEGE,13124,2,-33.43194675,-70.76410404,366,1,10
10183,ESCUELA PARTICULAR CARLOS PEZOA VELIZ,13103,2,-33.42716637,-70.72888489,183,1,10
10186,ESCUELA PARTICULAR LA FRONTERA,13103,2,-33.42382413,-70.74767302,504,1,10
10187,COLEGIO BICENTENARIO MADRE ANA EUGENIA,13124,2,-33.43702459,-70.75238365,1591,1,10
10191,ESCUELA PARTICULAR LA CIUDAD EDUCATIVA,13124,2,-33.44063348,-70.76215099,104,1,110
10193,COLEGIO POLIV. SAINT ORLAND N 3,13103,2,-33.41660995,-70.7576067,1252,1,10
10196,LICEO INDUSTRIAL BICENTENARIO BENJAMIN DAVILA LARRAIN,13128,4,-33.40438993,-70.70056326,796,1,310
10197,ESCUELA JUANA DE LESTONAC,13128,1,-33.40298808,-70.72370354,275,1,10
10199,LICEO POLIVALENTE A80 PRESIDENTE JOSE MANUEL BALMACEDA,13108,1,-33.41894040999999,-70.66943496,992,1,10
10200,ESCUELA BASICA ISABEL LE BRUN,13128,1,-33.40505077,-70.71227233,879,1,10
10201,LICEO THOMAS ALVA EDISON,13128,1,-33.39868189,-70.70159944,402,1,10
10202,ESCUELA DOMINGO SANTA MARIA GONZALEZ,13128,1,-33.40484033,-70.71058362,598,1,10
10204,ESCUELA CAPITAN JOSE LUIS ARANEDA,13128,1,-33.40527766,-70.72328619,358,1,10
10205,ESCUELA GENERAL MANUEL BULNES PRIETO,13128,1,-33.41633153,-70.68530905,346,1,10
10207,ESCUELA REBECA MATTE BELLO,13128,1,-33.40389768,-70.73007011,1015,1,10
10210,ESCUELA GENERAL ALEJANDRO GOROSTIAGA O,13128,1,-33.39329536999999,-70.69644571,392,1,10
10212,ESCUELA JUANA ATALA DE HIRMAS,13128,1,-33.42176612,-70.67654668,459,1,10
10216,ESC. BASICA MONSERRAT ROBERT DE GARCIA,13128,1,-33.40453575,-70.73666029,316,1,10
10217,COLEGIO PARTICULAR HELENICO,13128,2,-33.39834523999999,-70.72224457,210,1,10
10219,COLEGIO CORAZON DE JESUS DE RENCA,13128,2,-33.40076507,-70.70422985,206,1,10
10220,COLEGIO PRESIDENTE ALESSANDRI,13108,2,-33.41987512,-70.6755671,1189,1,10
10221,COLEGIO PARTICULAR CHARLES DARWIN,13128,2,-33.40826233,-70.69279868,377,1,10
10223,LICEO SANTA TERESITA,13108,2,-33.41190513,-70.6745079,705,1,310
10224,COLEGIO ARTURO TORO AMOR,13108,2,-33.41775922,-70.67122612,1217,1,10
10225,ESCUELA PARTIC. COLEGIO BALMACEDA-RENCA,13128,2,-33.40210596,-70.71797923,276,1,10
10226,ESCUELA PARTICULAR SAN GENARO,13128,2,-33.40446948,-70.71986565,631,1,10
10228,ESCUELA PARTICULAR PRIMITIVA ECHEVERRIA,13128,2,-33.40333308999999,-70.70751846,689,1,10
10229,ESCUELA PARTICULAR JOSE BERNARDO SUAREZ,13128,2,-33.40043982,-70.71670618,243,1,10
10232,COLEG. POLIV. SANTA MARIA DE LA PROVIDENCIA,13128,2,-33.41036968,-70.68889435,754,1,10
10233,ESCUELA PARTICULAR SAN FIDEL,13128,2,-33.40371933,-70.70577317,551,1,10
10234,ESCUELA ESPECIAL PARTICULAR ESPERANZA,13128,2,-33.405064,-70.70564,122,1,212
10235,ESCUELA BASICA  N° 878  LOS ACACIOS,13128,2,-33.40723135,-70.69227213,304,1,10
10239,ESCUELA ESTADO DE MICHIGAN,13125,1,-33.36681973999999,-70.73559355,768,1,10
10240,ESCUELA LUIS CRUZ MARTINEZ,13125,1,-33.367279,-70.71665627,1466,1,10
10241,ESCUELA BASICA EL MANIO,13125,1,-33.37081645,-70.74384787,331,1,10
10245,PARROQUIAL NUESTRA SEÑORA DEL CARMEN DE QUILICURA,13125,2,-33.3650046,-70.72984056,799,1,10
10246,COLEGIO POLIV. SANTA MARIA,13125,2,-33.36956700999999,-70.73572442,2054,1,10
10247,ESCUELA BASICA PART PAULA JARAQUEMADA,13125,2,-33.36708946,-70.73171811,1293,1,10
10248,LICEO INSTITUTO TECNOLOGICO Y COMERCIAL RECOLETA-INTECO,13127,4,-33.41285597,-70.63801727,711,1,310
10250,CENTRO EDUCACIONAL DE HUECHURABA,13107,1,-33.37459022,-70.6342271,698,1,110
10251,LICEO POETA FEDERICO GARCIA LORCA,13104,1,-33.37003144,-70.69107767,619,1,10
10252,LICEO ARTURO PEREZ CANTO,13127,1,-33.40144256,-70.62933512,727,1,10
10253,LICEO POLIV. ABDON CIFUENTES,13104,1,-33.39636702,-70.66311222,1126,1,10
10254,CENTRO EDUCACIONAL JOSE MIGUEL CARRERA,13127,1,-33.38346707,-70.65713504,352,1,110
10255,COMPLEJO EDUCACIONAL JUANITA FERNANDEZ SOLAR,13127,1,-33.40273633999999,-70.64189276,619,1,310
10257,ESCUELA SARGENTO 2. DANIEL REBOLLEDO,13127,1,-33.39256791999999,-70.6508209,511,1,10
10259,LICEO ALBERTO BLEST GANA,13104,1,-33.39929925,-70.66823613,848,1,10
10260,ESCUELA UNESCO,13104,1,-33.38153869,-70.67684986,331,1,10
10262,ESCUELA ESPANA,13127,1,-33.39606928,-70.64101814,610,1,10
10263,ESCUELA D-114,13104,1,-33.37152685,-70.67835331,268,1,10
10264,ESCUELA SOL NACIENTE,13104,1,-33.38702998,-70.66150647,306,1,10
10265,ESCUELA HORACIO JOHNSON GANA,13104,1,-33.37614189,-70.66730919,345,1,10
10266,ESCUELA DRA.ELOISA DIAZ INSUNZA,13104,1,-33.38236108,-70.65981063,684,1,10
10267,ESCUELA ESCRITORA MARCELA PAZ,13127,1,-33.38432812,-70.6519407,489,1,10
10268,ESCUELA PUERTO RICO,13127,1,-33.39812655,-70.63977774,377,1,10
10269,LICEO MUNC.ALMIRANTE GALVARINO RIVEROS,13104,1,-33.37273641,-70.68165689,457,1,10
10270,CENTRO EDUC.ESCRITORES DE CHILE,13127,1,-33.38516368,-70.64526119,601,1,10
10271,ESCUELA ARAUCARIAS DE CHILE,13104,1,-33.37984929999999,-70.66044333,280,1,10
10272,ESCUELA BASICA CARLOS PRATS G.,13107,1,-33.36838837,-70.63674587,525,1,10
10273,ESCUELA VALLE DEL INCA,13104,1,-33.38950013,-70.66642576,337,1,10
10277,ESCUELA ADELAIDA LA FETRA,13107,1,-33.36655412999999,-70.63423348,628,1,10
10278,ESCUELA PEDRO AGUIRRE CERDA,13104,1,-33.39430707999999,-70.6823422,308,1,10
10279,ESCUELA ALLIPEN,13104,1,-33.38061093999999,-70.68575489,300,1,10
10280,ESCUELA BÁSICA POETA EUSEBIO LILLO,13104,1,-33.37750382,-70.69332638,302,1,10
10281,ESCUELA ATENEA,13104,1,-33.39951614,-70.66924207,491,1,10
10282,ESCUELA LUIS GALDAMES,13108,1,-33.40638246,-70.67304535,297,1,10
10283,ESCUELA AVIADOR DAGOBERTO GODOY F.,13104,1,-33.37860004,-70.67227419,504,1,10
10285,ESCUELA SANTA VICTORIA DE HUECHURABA,13107,1,-33.37401336,-70.64241618,396,1,10
10288,ESCUELA BASICA LIKAN-ANTAI,13104,1,-33.37608717,-70.6645136,161,1,10
10290,ESCUELA LAS CANTERAS,13107,1,-33.37636702999999,-70.62359714,330,1,10
10291,ESCUELA VICTOR CUCCUINI,13127,1,-33.40249084,-70.6354352,352,1,10
10293,ESCUELA ESP. HUMBERTO ARANDA IRRIBARREN,13104,1,-33.39729299999999,-70.66296,82,1,212
10300,ESCUELA MARTA COLVIN,13127,1,-33.40627168999999,-70.62420549,202,1,10
10301,ESCUELA CAMILO HENRIQUEZ,13104,1,-33.38870845,-70.67837993,438,1,10
10302,ESCUELA ANNE ELEONOR ROOSEVELT,13127,1,-33.41242581,-70.62560669,193,1,10
10305,ESCUELA SANTIAGO DE GUAYAQUIL,13107,1,-33.37853614,-70.64311721,362,1,10
10306,ESCUELA MUN.HERMANA MARIA GORETTI,13127,1,-33.38916527,-70.63758855,426,1,10
10307,ESCUELA RAFAEL VALDIVIESO,13127,1,-33.41270393,-70.6364024,637,1,10
10309,ESCUELA EDUC.DIF. STA. TERESA DE AVILA,13127,1,-33.40449499999999,-70.648285,289,1,212
10313,COLEGIO POLIV. ALEJANDRO FLORES,13127,2,-33.4051111,-70.64571246,1255,1,10
10315,COLEGIO CRISTOBAL COLON,13104,2,-33.37548506,-70.68012656,843,1,10
10320,LICEO AVENIDA RECOLETA,13127,2,-33.39025525,-70.64273366,1450,1,10
10321,LICEO LAS AMERICAS MODERNAS,13108,2,-33.40860646,-70.66716781,184,1,110
10324,ESCUELA JOSE ABELARDO NUÑEZ Nº 3,13107,2,-33.37478971,-70.64029001,1002,1,10
10326,ESCUELA PARTICULAR SAN JOSE,13127,2,-33.40426175999999,-70.64490963,632,1,10
10327,ESCUELA PARTICULAR SANTA TERESITA,13108,2,-33.41268800999999,-70.67269637,787,1,10
10329,COLEGIO LIBERTADOR SAN MARTIN,13104,2,-33.39112361,-70.67462279,1092,1,10
10331,COLEGIO ISABEL RIQUELME,13127,2,-33.40382487,-70.63137694,227,1,10
10332,ESCUELA PARTICULAR EL CARMEN,13104,2,-33.38396938999999,-70.67797712,1194,1,10
10333,ESCUELA PARTICULAR N.SRA.DE GUADALUPE,13127,2,-33.39836347,-70.6363131,675,1,10
10334,ESCUELA PATROCINIO EL SEMBRADOR N 2,13104,2,-33.39665233,-70.67256715,350,1,10
10335,ESCUELA SAN JORGE,13108,2,-33.40191141999999,-70.6775681,288,1,10
10336,ESCUELA PARTICULAR SAN DIEGO,13104,2,-33.38441333,-70.67975904,1302,1,10
10337,COLEGIO MATER DOLOROSA,13107,2,-33.37498257,-70.63959733,751,1,10
10338,ESCUELA BASICA SANTO DOMINGO,13127,2,-33.3960469,-70.65270549,543,1,10
