25749,COLEGIO PART. ALICANTE DEL ROSAL,13119,2,-33.49069933,-70.77983929,3206,1,10
25750,ESCUELA ESPECIAL SONRISA DE NINOS,13201,2,-33.608547,-70.59296,90,1,214
25751,COLEGIO LIAHONA CORDILLERA,13110,2,-33.5436023,-70.5865,983,1,10
25752,CENTRO DE EDUC. INTEGRADA DE ADULTOS TALAGANT,13601,2,-33.6599,-70.92639,233,1,167
25753,CENTRO EDUC. PRINCIPADO DE ASTURIA ADULTO,13201,2,-33.58247,-70.58066,310,1,165
25754,ESC. ESPECIAL LAS ESPIGAS DE ESTACION CENTRAL,13106,2,-33.44883999999999,-70.69238,84,1,214
25756,ESCUELA ESPECIAL PART. ELIAS CANESSA VERGARA,13119,2,-33.51516999999999,-70.763954,36,1,214
25757,ESC. ESP. PART. TRIGAL DE HUECHURABA,13107,2,-33.375095,-70.63133,86,1,212
25764,ESC. DE PARV. Y ESP. CASABLANCA DE SAN BERNAR,13401,2,-33.603985,-70.70261,127,1,10
25765,ESC. ESPECIAL PART. AULENCO,13119,2,-33.48861999999999,-70.73415,111,1,214
25766,LINCOLN COLLEGE SAN MARTIN,13119,2,-33.52432341,-70.77775865,1652,1,10
25767,COLEGIO SAN JORGE DE LAS CONDES,13114,2,-33.41157772999999,-70.55218473,343,1,10
25770,LICEO NACIONAL DE MAIPU,13119,1,-33.519165,-70.79245418,1393,1,110
25772,ESCUELA DE PARV. PART. HAPPY GARDEN,13110,2,-33.537193,-70.59308,26,1,10
25773,ESCUELA ESP. PART. SAGRADA FAMILIA DE SAN BER,13401,2,-33.588272,-70.70476,107,1,214
25774,ESCUELA ESP. PART. ARRAYAN,13110,2,-33.54679,-70.59286,123,1,10
25775,COLEGIO PARTICULAR DE ADULTOS SANTA MARIA DEL TRABAJO,13119,2,-33.51515,-70.764305,67,1,363
25776,ESC. PART. PARV. HEIDI GARDEN SCHOOL,13129,2,-33.518185,-70.633644,26,1,10
25779,COLEGIO POLIV. CARDENAL JOSE MARIA CARO,13112,2,-33.56444442,-70.62513826,1559,1,10
25781,COLEGIO BICENTENARIO ARZOBISPO CRESCENTE ERRAZURIZ,13201,2,-33.57373561,-70.60597188,1659,1,10
25782,ESC. ESP. PART. ARAUCARIAS DE PENALOLEN,13122,2,-33.50540999999999,-70.584076,49,1,214
25783,COLEGIO POLIV. ARZOBISPO MANUEL VICUNA,13129,2,-33.48720121,-70.63987727,553,1,10
25784,ESCUELA ESP. PART. ARBOLIRIS,13129,2,-33.490093,-70.629,97,1,214
25785,COLEGIO PART. ROYAL AMERICAN SCHOOL,13119,3,-33.50292618999999,-70.76202055,490,1,10
25786,ESCUELA ESPECIAL PARTICULAR KINERET,13125,2,-33.36146,-70.72925,248,1,212
25787,ESC. ESP. PART. DIEGO THOMPSON,13131,2,-33.536316,-70.6497,96,1,214
25788,ESCUELA BASICA ANA FRANK,13125,1,-33.35866849,-70.73691879,796,1,10
25790,COLEGIO POLIV. DIEGO PORTALES DE MAIPU,13119,2,-33.50972156,-70.79033443,657,1,10
25791,ESCUELA ESP. PART. RIGOBERTA MENCHU,13201,2,-33.595737,-70.568504,65,1,212
25792,ESCUELA ESP. PART. SANTA MARIA DE QUILICURA,13125,2,-33.37073999999999,-70.73504,137,1,214
25793,ESC. ESP. PART. GABRIELA MISTRAL DE PENALOLEN,13122,2,-33.468685,-70.56658,46,1,214
25795,COLEGIO PARTICULAR BLUMENTHAL,13601,2,-33.68726358,-70.97063465,324,1,310
25797,ESCUELA B-SICA PUCARA LASANA,13125,1,-33.37732411,-70.72770616,293,1,10
25798,COLEGIO RELIGIOSO SANTA MARGARITA,13130,2,-33.50547992,-70.64704376,467,1,110
25799,ESC. BAS. PART. ERNESTINA KRISCHUK,13201,2,-33.6254626,-70.58124169,284,1,10
25801,ESCUELA ESP. LA ESPIGA,13201,2,-33.58279799999999,-70.57889,262,1,212
25803,ESC. PART. ALBERT SCHWEITZER,13201,2,-33.62928372999999,-70.62308812,250,1,10
25804,COLEGIO PART. ANTUPIREN,13122,2,-33.47572099,-70.55512798,1398,1,10
25807,ESCUELA ESP. PART. LA PASCANA,13110,2,-33.558006,-70.59159,118,1,214
25808,ESC. BAS. PART. LAS NACIONES,13119,2,-33.52186111999999,-70.7866748,243,1,10
25809,ESC.ESP. PART.SAN VICENTE DE PAUL DE CONCHAL-,13104,2,-33.394653,-70.66345,53,1,214
25812,LICEO MUNICIP. DE ADULTOS PEDRO J. RODRIGUEZ,13302,1,-33.235577,-70.805145,95,1,165
25814,COLEGIO SAYEN,13501,2,-33.67894251,-71.18883807,543,1,10
25818,COLEGIO PART. ADULTOS INSTITUTO ICEL,13101,2,-33.44225999999999,-70.664085,1523,1,165
25819,ESCUELA ESP. PART. SAN PIO DE PIETRELCINA,13303,2,-33.079037,-70.92803,40,1,214
25822,ESCUELA DE PARVULOS N°1980  SAN ANTONIO MARIA ZACCARIA II,13101,3,-33.46755,-70.65258,24,1,10
25823,ESCUELA DE LAS ARTES Y LA TECNOLOGIA,13119,1,-33.50036446,-70.75381662,37,1,110
25824,LICEO SERGIO SILVA BASCUNAN,13112,2,-33.56434498,-70.64427002,638,1,310
25825,COLEGIO SAN MIGUEL ARCANGEL DE LAS CONDES,13114,3,-33.388741,-70.53289,732,1,10
25826,COLEGIO ADVENTISTA LA FLORIDA,13110,2,-33.53647359,-70.5766549,305,1,10
25828,ESC. ESPECIAL PART. JAN VAN DIJK,13120,2,-33.454105,-70.625175,39,1,213
25829,COLEGIO PART. SAN ADRIAN DE QUILICURA,13125,2,-33.36128327,-70.73088382,1051,1,10
25831,ESCUELA BASICA PARTICULAR CONTEMPORA,13110,2,-33.53789493,-70.55470427,205,1,10
25832,COLEGIO PART. PAN AMERICAN COLLEGE SANTIAGO,13130,3,-33.48776776999999,-70.65133032,477,1,10
25833,ESCUELA BASICA N° 1986 SAINT PAUL MONTESSORI SCHOOL,13114,3,-33.421802,-70.58768,46,1,110
25834,ESCUELA ESP. PART. EL PRINCIPITO DE LO HERRER,13401,2,-33.670834,-70.742035,147,1,214
25836,ESCUELA PART. ROSA JARAQUEMADA,13120,2,-33.45202712999999,-70.62421611,149,1,10
25838,ESCUELA BAS. MY GARDEN SCHOOL,13117,2,-33.44395416999999,-70.72220958,218,1,10
25839,ESC. BAS. Y ESP. CELEI,13117,2,-33.4482839,-70.71826202,211,1,110
25842,COLEGIO DIVINA PASTORA,13110,3,-33.54568692,-70.58866088,692,1,10
25843,COLEGIO PART. SAGRADO CORAZON DE TALAGANTE,13601,2,-33.65232888,-70.89579438,950,1,10
25845,ESCUELA PART. SAN MARCELO N_ 3,13112,2,-33.62247313,-70.63324941,278,1,10
25847,ESCUELA ESP. PART. SANTA ROSA DE MELIPILLA,13501,2,-33.68222,-71.22067,177,1,214
25850,COLEGIO DEL VALLE,13119,2,-33.55239086,-70.78193489,841,1,10
25851,ESC. PART. EL ARRAYAN DE MAIPU,13119,2,-33.4803315,-70.73707526,345,1,10
25852,COLEGIO DIVINA PASTORA NUNOA,13120,3,-33.45912748,-70.60557619,934,1,10
25853,COLEGIO POLIVALENTE NOVO HORIZONTE,13125,2,-33.35796100999999,-70.72128708,992,1,10
25854,CENTRO ESTI. DE HAB. COMUNICATIVAS AMERICA,13401,2,-33.58129,-70.704636,75,1,214
25855,LICEO BICENTENARIO CHACABUCO,13301,1,-33.19548956,-70.68097963,1068,1,110
25856,ESCUELA ESP. PART. APRAVI,13126,2,-33.425838,-70.710831,67,1,214
25859,ESCUELA ESP. PART. RALUI,13101,2,-33.45638799999999,-70.638266,74,1,214
25860,ESCUELA ESP. PART. CORDILLERA ORIENTE,13201,2,-33.5694,-70.587135,211,1,214
25862,ESCUELA ESP. PART. CAPULLITOS DE SOL,13118,2,-33.490845,-70.60368,281,1,214
25865,SAN IGNACIO COLLEGE,13401,2,-33.61661823,-70.70388548,786,1,10
25867,ESCUELA PART. AMANECER DE LA GRANJA,13111,2,-33.54389599999999,-70.627556,127,1,214
25869,ESCUELA ESP. PART. SAN NICOLAS,13109,2,-33.520695,-70.66329,86,1,214
25872,ESCUELA DE PARV. CARRUSEL DE AMIGOS,13401,2,-33.56414999999999,-70.70385,13,1,10
25873,ESCUELA ESP. DE LENGUAJE PLAZA SESAMO,13119,2,-33.48934599999999,-70.76651,89,1,214
25874,COLEGIO DE ADULTOS PART. VASCO DE GAMA,13130,2,-33.509247,-70.65673,44,1,363
25876,COLEGIO CENTRO EDUC. Y FAMILIAR PTE ALTO,13201,2,-33.62368,-70.589165,258,1,167
25877,ESCUELA ESPECIAL DE LENGUAJE SAN NICOLÁS DE BELÉN,13104,2,-33.383812,-70.679756,120,1,214
25878,ESCUELA ESP. PART. AMANTU,13130,2,-33.498413,-70.66044,120,1,214
25881,ESCUELA ESP. PART. PATAGONIA,13103,2,-33.420578,-70.735466,149,1,212
25882,COLEGIO NOBEL GABRIELA MISTRAL,13401,2,-33.60652263,-70.67359033,1066,1,10
25883,ESC. ESP. PART. SAN MATEO DEL BOSQUE,13105,2,-33.552643,-70.66487,61,1,217
25884,ESCUELA ESP. PART. ACONCAGUA DE COLINA,13301,2,-33.20304999999999,-70.67969,174,1,214
25885,COLEGIO INTERCULTURAL TREMEMN,13119,2,-33.50125475,-70.76236532,1054,1,10
25886,ESCUELA ESPECIAL RICALHUE,13404,2,-33.81674,-70.74013,83,1,214
25887,ESCUELA ESPECIAL PART. ARCO IRIS,13404,2,-33.80942499999999,-70.73694,114,1,214
25890,ESCUELA ESPECIAL DE LENGUJE MIS AMIGUITOS,13111,2,-33.55709499999999,-70.62362,175,1,214
25894,COLEGIO MANANTIAL DE SAN MIGUEL,13130,2,-33.51093318,-70.66351589,409,1,10
25895,COLEGIO SANTIAGO DE PUDAHUEL,13124,2,-33.45642781,-70.75547931,1038,1,110
25897,ESCUELA PART. INSTITUTO S.A,13110,2,-33.56201232,-70.6100822,289,1,10
25899,LICEO JOSE ABELARDO NUÑEZ Nº 4,13107,2,-33.37435705,-70.64123476,541,1,110
25900,ESC. ESP. VOCARE,13129,2,-33.498474,-70.625275,101,1,212
25901,ESC. EVANG. PENTECOSTAL DR. WILLIS C. HOOVER,13122,2,-33.46587525,-70.55762379,415,1,10
25902,ESC. DE PARV. Y ESP. RAHUE,13501,2,-33.69124999999999,-71.21982,90,1,10
25903,ESCUELA ESP. MI ESPACIO,13101,2,-33.47368199999999,-70.67149,104,1,214
25904,ESCUELA ESP. PART. VALLE DEL SOL,13118,2,-33.47811,-70.59822,178,1,214
25906,ESCUELA ESP. PARTICULAR OSCAR CASTRO,13126,2,-33.443672,-70.70164,85,1,214
25907,ESCUELA ESP. PART. SAN JOSE DE SAN BERNARDO,13401,2,-33.599747,-70.6933,95,1,212
25909,ESCUELA ESPECIAL ARCOIRIS,13201,2,-33.6146,-70.58699,96,1,214
25912,ESCUELA ESP. PART. SAN JORGE DE QUINTA NORMAL,13126,2,-33.429283,-70.69358,206,1,214
25913,ESCUELA ESP. PART. CHARLES DE GAULLE,13401,2,-33.59931,-70.694,115,1,212
25914,ESCUELA PARTICULAR SUBVENCIONADA SAN JORGE DE COLINA,13301,2,-33.21208,-70.67878,206,1,10
25916,ESCUELA BAS. SAN SEBASTIAN DE COLINA,13301,2,-33.20407949,-70.67895685,1019,1,10
25918,ESCUELA ESP. PART. CAMINO A BELEN N¦ 2,13107,2,-33.359146,-70.68974,48,1,214
25919,ESCUELA BASICA NEHUEN,13601,2,-33.66081641,-70.92356487,431,1,10
25920,ESCUELA ESP. PART. CALIN,13103,2,-33.418186,-70.7252,146,1,214
25921,COLEGIO CENTRO EDUCACIONAL ROUSSEAU,13119,2,-33.48617818,-70.76297223,565,1,10
25922,COLEGIO TERRA AUSTRALIS,13124,2,-33.43240068,-70.77229196,1542,1,10
25923,ESCUELA ESP. PADRE PIO,13110,2,-33.53721199999999,-70.57527,85,1,212
25926,COLEGIO POLIV. JERUSALEN DE LAMPA,13302,2,-33.28161332,-70.87669963,1460,1,10
25927,ESCUELA BASICA TERRA DI BIMBI,13605,2,-33.61146269,-70.8961616,333,1,10
25929,COLEGIO PADRE PEDRO ARRUPE SAGRADA FAMILIA,13125,2,-33.3661808,-70.74398967,1058,1,10
25932,COLEGIO DE ADULTOS LONDON DE LA FLORIDA,13110,2,-33.55834999999999,-70.59506,161,1,165
25933,ESCUELA BASICA ALBORADA SCHOOL,13605,2,-33.6057299,-70.89150981,261,1,10
25935,ESCUELA ESPECIAL LA ISLA,13601,2,-33.666969,-70.922974,102,1,212
25936,COLEGIO NUEVO HORIZONTE DE PUENTE ALTO,13201,2,-33.59467654,-70.60137751,766,1,10
25937,ESC. DE PARV. Y ESPECIAL COMUNICA,13602,2,-33.67832,-70.99515,104,1,10
25938,LICEO DE ADULTOS CEIA DE LA PINTANA,13112,1,-33.5598,-70.62844,311,1,165
25940,ESCUELA DE PARV. PARQUE O'HIGGINS,13101,1,-33.468187,-70.658462,61,1,10
25941,ESCUELA PART. SPRING COLLEGE N_ 2,13130,2,-33.49658417,-70.66312412,179,1,110
25944,ESCUELA PART. PARTHENON COLLEGE,13605,2,-33.61007141999999,-70.86609189,589,1,10
25946,ESCUELA PARVULOS MY SECOND HOME,13119,2,-33.513958,-70.770584,26,1,10
25950,COLEGIO SEMPER ALTIUS,13110,2,-33.51729268999999,-70.55430859,139,1,310
25951,COLEGIO DE ADULTOS CARELMAPU DE CONCHALI,13104,2,-33.383915,-70.66929,205,1,363
25952,ESCUELA DE PARV. BERNARD COLLEGE DE SAN BERNA,13401,2,-33.59868999999999,-70.70839,128,1,10
25953,ESC. ESP.PART. SAN AGUSTIN DE INDEPENDENCIA,13108,2,-33.417583,-70.66254,120,1,214
25954,ESC. BAS. Y ESP. NTRA. SRA. DE LAS NIEVES,13401,2,-33.64243454999999,-70.73421338,547,1,10
25958,ESCUELA BASICA N°2047 MIRASOL DE SANTIAGO,13101,3,-33.463335,-70.66482,134,1,110
25959,ESC. ESPECIAL HOSPITAL SAN JUAN DE DIOS,13101,2,-33.4424925,-70.67871,11,1,10
25960,CENTRO EDUC. PADRE ALBERTO HURTADO DE SAN BER,13401,1,-33.60390082,-70.68000637,1179,1,10
25961,COLEGIO PALMARES,13125,2,-33.35725613999999,-70.73737333,1978,1,10
25964,ESCUELA ESP. PART. ACONCAGUA DE BATUCO,13302,2,-33.23767,-70.807434,144,1,214
25965,ESCUELA ESP. LAS BARRANCAS,13124,2,-33.43717199999999,-70.76931,95,1,214
25966,ESCUELA DE PARVULOS N°2053 `CAMINO DE VIDA`,13119,2,-33.48854,-70.77853,19,1,10
25969,COLEGIO TERCER MILENIO,13125,2,-33.35556417,-70.73925187,1019,1,110
25970,ESCUELA BAS. Y ESP. EDUCAR,13605,2,-33.61065434,-70.87279211,84,1,110
25971,ESCUELA ESP. ESTACION ACUARELA,13106,2,-33.4564,-70.691605,90,1,214
25972,ESCUELA ESP. DIVINO MAESTRO DE CERRILLOS,13102,2,-33.496162,-70.72793,86,1,214
25976,ESC. BASICA Nº 136 SAN SEBASTIAN DE PAINE,13404,2,-33.80736512,-70.73236432,489,1,10
25977,COLEGIO DE AD. SANTA MARIA DEL TRABAJO DE EST,13106,2,-33.46542999999999,-70.69069,67,1,363
25979,ESCUELA DE PARV. CIUDAD BEBE,13110,2,-33.566586,-70.588646,17,1,10
25982,CENTRO EDUCACIONAL DE ADULTOS PADRE ALBERTO HURTADO,13604,2,-33.57229199999999,-70.813126,184,1,363
25983,ESCUELA DE PARVULOS TERESITA,13110,2,-33.54180499999999,-70.59556,28,1,10
25984,COLEGIO DREYSE BELSER,13605,2,-33.59987247,-70.88204936,394,1,10
25988,COLEGIO JUAN LUIS UNDURRAGA ANINAT,13125,2,-33.364773,-70.75768972,1610,1,10
25991,ESCUELA BAS. AMANKAY DE LAMPA,13302,2,-33.23859870999999,-70.80914831,599,1,10
25993,ESCUELA ESP. SAN JUAN DE DIOS,13118,2,-33.48604,-70.59252,141,1,217
25994,ESCUELA ESP. PABLO NERUDA DE LA FLORIDA,13110,2,-33.53416,-70.58549,179,1,214
25995,CENTRO POLITEC. CARLOS CONDELL DE LA CISTERNA,13109,2,-33.54357439999999,-70.66104028,547,1,310
25996,ESCUELA ESP. EL CARMEN,13403,2,-33.626934,-70.77816,53,1,212
25997,ESCUELA ESP. KINCUIN,13401,2,-33.597473,-70.698555,163,1,10
25998,ESCUELA ESP. TU ESPERANZA,13121,2,-33.48937,-70.663734,35,1,212
25999,COLEGIO ALICANTE DEL SOL,13201,2,-33.59597265,-70.58664948,3263,1,10
26000,ESCUELA ESP. SOL DE LA REINA,13113,2,-33.46201,-70.55381,93,1,212
26001,COLEGIO ALICANTE DE LA FLORIDA,13110,2,-33.53595055,-70.55599089,1650,1,10
26003,ESC. ESPECIAL ELSA MATILDE ULRICH JARA,13301,1,-33.207962,-70.67226,257,1,214
26004,ESCUELA ESP. RENACERES,13127,2,-33.40889,-70.64416,82,1,214
26005,ESCUELA ESP. MI MUNDO EN PALABRAS,13117,2,-33.445526,-70.71427,113,1,214
26006,COLEGIO ECOLOGICO PAINE,13404,2,-33.86188438,-70.75310598,602,1,10
26012,COLEGIO BICENTENARIO MODERNO PAINE,13404,2,-33.80574703,-70.72592107,911,1,110
26013,ESCUELA ESP.  JOSE MAZA FERNANDEZ,13112,2,-33.62212799999999,-70.63713,88,1,214
26014,ESCUELA ESP. BILBAO,13605,2,-33.607956,-70.87913,77,1,214
26015,ESC.BASICA Y ESP.MARIA DE LOS ANGELES DE BUIN,13402,2,-33.71460812,-70.67967766,247,1,110
26016,ESCUELA ESP. ESPERANZA DE EL BOSQUE,13105,2,-33.580173,-70.674286,133,1,214
26017,ESCUELA BAS. KINGS SCHOOL,13401,2,-33.62112540999999,-70.68900617,595,1,10
26019,ESCUELA BASICA Y ESPECIAL N° 2078 GENESIS 2005,13122,2,-33.503056,-70.57281,249,1,10
26021,ESC. DE PARV. Y ESP. SAN PIO DE TALAGANTE,13601,2,-33.654701,-70.910187,261,1,10
26022,ESCUELA ESP. FERNANDA FRIAS RETAMAL,13127,2,-33.40885,-70.644325,53,1,212
26025,COLEGIO SANTA BARBARA COLLEGE,13105,2,-33.57501887,-70.66321219,538,1,10
26027,COLEGIO DE AD. INSTITUTO NUEVA IMAGEN,13605,2,-33.605843,-70.89175,43,1,363
26028,COLEGIO EMMANUEL HIGH SCHOOL,13110,3,-33.52677545,-70.58333077,469,1,10
26030,COLEGIO DE ADULTOS INSTITUTO NUEVO BILBAO,13123,3,-33.43912,-70.62688,165,1,165
26031,ESCUELA DE PARV. MI PRIMERA AVENTURA,13118,2,-33.49096999999999,-70.61009,25,1,10
26032,INSTITUTO DE EDUCACIÓN DE ADULTOS LA CASTRINA,13129,2,-33.516163,-70.633194,31,1,363
26033,COLEGIO  SAN CARLOS DE QUILICURA,13125,2,-33.35727832,-70.7266422,1990,1,10
26035,ESCUELA PART. SAN JOSE DE LAMPA,13302,2,-33.28825837,-70.87086537,1176,1,10
26036,ESCUELA ESPECIAL N 2086 HOSPITAL CLINICO PONTIFICIA UNIVERSIDAD CATÓLICA DE CHILE,13101,2,-33.44217648,-70.64025566,20,1,10
26037,COLEGIO LO BARNECHEA,13115,1,-33.3642831,-70.4990235,1179,1,10
26043,ESCUELA SANTA TERESA DE LOS ANDES,13402,3,-33.73374735,-70.75507335,94,1,110
26044,ESCUELA BAS. Y ESP. LIKAN-RAY DE LA PINTANA,13112,2,-33.61228375999999,-70.6268291,468,1,10
26045,ESCUELA  SAN PEDRO VALLE GRANDE,13302,2,-33.32204578,-70.74706347,998,1,10
26046,COLEGIO  MANQUECURA CIUDAD DE LOS VALLES,13124,3,-33.450623,-70.84866,1655,1,10
26047,ESCUELA DE PARV. PIN PON,13106,2,-33.46744,-70.69736,37,1,10
26048,COLEGIO DE ADULTOS ALFRED NOBEL EL BOSQUE,13105,2,-33.579926,-70.672646,98,1,165
26051,ESCUELA DE PARV. EL CASTILLO,13119,3,-33.537205,-70.78841,28,1,10
26053,COLEGIO ATENAS,13110,2,-33.52208499999999,-70.56177783,1656,1,10
26054,COLEGIO DE ADULTOS INSTITUTO ROGERIANO,13201,2,-33.580883,-70.55912,306,1,165
26057,ESCUELA DE PARVULOS N°2097 LOS ENANITOS,13119,2,-33.538048,-70.78733,58,1,10
26061,COLEGIO DE ADULTO LAURA VICUNA DE RENCA,13128,2,-33.403065,-70.71002,366,1,165
26062,COLEGIO DE AD. SAN JAVIER DE SAN MIGUEL,13130,2,-33.50548,-70.64704,132,1,363
26063,COLEGIO DE AD. INSTITUTO HUMBOLDT,13112,2,-33.622337,-70.628,130,1,165
26064,ESCUELA ESP. SAN MARTIN,13110,2,-33.551052,-70.595825,128,1,214
26066,ESC. DE PARV. SEMILLITA MONTESSORI,13130,2,-33.50239599999999,-70.65521,65,1,10
26068,ESCUELA BAS. LICARITO,13110,2,-33.54721413,-70.59468651,219,1,10
26070,CENTRO EDUC. REGULAR DE ADULTOS CEDEA,13110,2,-33.56114,-70.56959,43,1,165
26071,ESCUELA DE PARVULOS Y ESP. DA VINCE,13401,2,-33.601543,-70.69373,85,1,10
26075,ESCUELA BAS. SAN JOSE DE PENALOLEN,13122,2,-33.50351502,-70.58654922,391,1,10
26076,ESCUELA DE PARVULOS OESTE,13102,2,-33.515565,-70.7081,50,1,10
26077,COLEGIO DE ADULTOS SEMBRADOR SAN BENITO,13301,2,-33.20456,-70.67463,85,1,363
26079,ESCUELA DE PARV. HELLO CHILDREN,13106,2,-33.466385,-70.72869,40,1,10
26080,COLEGIO SAINT ANDREW,13114,3,-33.388888,-70.54024,570,1,10
26081,ESCUELA ESP. DICKENS COLLEGE,13108,2,-33.417183,-70.67542,53,1,214
26082,ESCUELA DE PARVULOS HAMELIN,13106,3,-33.457,-70.68724,9,1,10
26083,COLEGIO SAN ALBERTO HURTADO,13125,2,-33.37063599999999,-70.71962767,1154,1,10
26084,COLEGIO EL BOSQUE DE RENCA,13128,2,-33.40377905999999,-70.74172543,772,1,10
26085,COLEGIO DE ADULTOS PRESBITERIANO DE MAIPU,13119,2,-33.50148999999999,-70.7646,84,1,363
26087,COLEGIO DE ADULTOS HERNANDO DE MAGALLANES,13110,2,-33.53514,-70.59833,213,1,363
26088,ESCUELA DE PARVULOS SANTA GEMITA DE GALGANI,13201,2,-33.61195,-70.56147,17,1,10
26090,ESCUELA DE PARV. GIRASOL DE MAIPU,13119,2,-33.468853,-70.748276,58,1,10
26091,ESC. ESPECIAL SEMILLITA DE LA FLORIDA,13110,2,-33.527214,-70.57014,62,1,214
26092,COLEGIO PEUMAYEN,13604,2,-33.56575727,-70.80999994,616,1,10
26093,ESCUELA ESPECIAL TONKI TONKI TON,13602,2,-33.68345,-70.9948,110,1,214
26094,COLEGIO LAS AMERICAS DE PAINE,13404,2,-33.82147216,-70.73912035,958,1,10
26097,ESCUELA ESP. ALDEBARAN,13201,2,-33.58666,-70.58595,138,1,214
26098,ESCUELA ESPECIAL DANICALIN,13401,2,-33.587868,-70.67363,165,1,10
26099,ESCUELA DE PARV. MANZANITA,13201,2,-33.59469,-70.56655,57,1,10
26100,ESCUELA ESP. EL RIEL,13116,2,-33.50462,-70.690445,66,1,214
26101,ESCUELA ESP. INTEGRA,13201,2,-33.60857,-70.56986,53,1,212
26104,ESCUELA ESP. TERESIANA DEL ESFUERZO,13110,2,-33.56095,-70.599075,67,1,214
26106,ESCUELA ESP. RUTH DE CONCHALI,13104,2,-33.38796,-70.67248,114,1,214
26107,ESCUELA ESPECIAL BARCELONA,13119,2,-33.49707,-70.76216,81,1,212
26108,ESC. BAS. Y ESP. SAN ANDRES DE PENAFLOR,13605,2,-33.61122302999999,-70.88551088,514,1,10
26110,COLEGIO SANTIAGO - QUILICURA,13125,2,-33.3619934,-70.71952192,1213,1,10
26111,ESC. DE PARV. Y ESP. PUKARAY,13402,2,-33.73355183,-70.74223478,754,1,10
26113,ESCUELA ESP. RINCONADA,13119,2,-33.506977,-70.783844,113,1,214
26114,ESCUELA ESP. LA VILLETE,13201,2,-33.624542,-70.5855,114,1,10
26115,COLEGIO TUPAHUE,13201,2,-33.60352664,-70.58378305,1198,1,110
26116,ESCUELA ESP. SILABAS,13122,2,-33.482807,-70.55716,51,1,214
26117,ESCUELA BÁSICA N 149 SAN MARCEL,13402,2,-33.713862,-70.74229207,1019,1,10
26121,ESCUELA ESP. CAMILA BINFA,13110,2,-33.553326,-70.57748,56,1,214
26126,ESC. ESP. MI NUEVO ARLEQUIN,13119,2,-33.498795,-70.763306,89,1,214
26128,ESC. DE PARV. Y ESP. KIMANTU DE PENAFLOR,13605,2,-33.61016,-70.89648,51,1,214
26129,ESCUELA BAS. MARIA JESUS,13123,3,-33.44058491,-70.61750616,32,1,110
26130,ESC. BAS. Y ESP. CHRIST SCHOOL DE PUDAHUEL,13124,2,-33.45649217999999,-70.74602695,663,1,10
26134,COLEGIO QUIMAY,13114,3,-33.42602,-70.5729,178,1,110
26135,ESC.BAS. EMPRENDER LARAPINTA,13302,2,-33.29550454999999,-70.87752956,1693,1,10
26137,COLEGIO DEL REAL,13119,2,-33.54886574999999,-70.76765823,433,1,10
26138,ESCUELA ESP. TRAGALUZ DEL BOSQUE,13105,2,-33.581608,-70.673004,90,1,212
26139,ESCUELA BAS. VILLA SAN IGNACIO,13124,2,-33.43366106,-70.77141978,423,1,10
26140,ESCUELA ESP. ANDALUE,13605,2,-33.601208,-70.86084,115,1,214
26143,COLEGIO DE AD. ANTONIO ACEVEDO,13121,2,-33.49118,-70.67311,196,1,165
26144,ESCUELA ESP. ANTIYAL,13401,2,-33.596367,-70.702194,72,1,214
26145,ESC. BAS. LA CANTERA DE MAPUHUE,13112,2,-33.59116085,-70.64697932,80,1,10
26147,ESCUELA ESPECIAL N° 2141 ALTA VIDA,13119,2,-33.486443,-70.76125,39,1,217
26148,ESC. ESP. CENTRO DE RECURSOS SUYAY,13105,2,-33.57188,-70.68867,42,1,214
26150,COLEGIO  FITZROY COLLEGE,13401,2,-33.61866779,-70.69676231,517,1,10
26151,ESCUELA ESP. ACTIVACION DE LA INTELIGENCIA SE,13201,2,-33.625151,-70.610668,74,1,212
26152,ESCUELA BASICA SAN PEDRO APOSTOL DE PAINE,13404,2,-33.80802280999999,-70.73709857,396,1,10
26155,ESCUELA BASICA N°2145 COLEGIO DUNALASTAIR PEÑALOLÉN,13122,3,-33.50064299999999,-70.55043,1016,1,10
26157,LICEO MUNICIPAL BICENTENARIO DE BATUCO,13302,1,-33.22714599999999,-70.80329,621,1,110
26158,ESCUELA BAS. AKORI,13102,2,-33.49922901,-70.72107247,313,1,10
26159,ESCUELA ESP. ANTUKUYEN DE EL MONTE,13602,2,-33.68255,-70.98812,103,1,214
26161,ESCUELA DE PARV. CARRUSEL DE MAIPU,13119,2,-33.537754,-70.784645,10,1,10
26163,ESCUELA ESPECIAL NEWEN DE PUENTE ALTO,13201,2,-33.604702,-70.589,68,1,214
26164,COLEGIO SAN JOSE DE CERRILLOS,13102,2,-33.50147308999999,-70.71721005,390,1,10
26166,ESCUELA ESP. PALABRAS MAGICAS,13201,2,-33.588203,-70.593475,58,1,214
26168,COLEGIO POLIVALENTE SAN PEDRO DE QUILICURA,13125,2,-33.35784499999999,-70.73684,324,1,310
26169,ESCUELA ESP. MI ISLITA,13603,2,-33.755226,-70.92267,141,1,214
26171,"ESCUELA BASICA N° 2150, COLEGIO MOUNIER",13114,3,-33.41371388999999,-70.57476481,63,1,10
26172,ESCUELA BAS. FALCON COLLEGE LITTLE,13126,2,-33.42738456,-70.71088276,352,1,10
26174,ESCUELA DE PARV. SANTA TERESITA DE JESUS,13201,2,-33.584152,-70.56679,19,1,10
26180,ESCUELA DE PARV. LA CASITA ENCANTADA,13110,2,-33.54956,-70.601974,42,1,10
26182,ESCUELA ESPECIAL TRIPANTU DE LA FLORIDA,13110,2,-33.5338,-70.57491,97,1,214
26183,ESCUELA DE PARV. BLANCA NIEVES DE LA FLORIDA,13110,2,-33.556995,-70.56636,64,1,10
26185,ESC. DE PARV. MI PARAGUITA,13119,2,-33.54678299999999,-70.783745,26,1,10
26187,ESCUELA DE PARV. LOS PEQUES,13201,2,-33.58397999999999,-70.570244,30,1,10
26191,ESCUELA DE PARV. FUTURAMA,13201,2,-33.597347,-70.55722,12,1,10
26195,ESCUEL DE PARV. LOS PIRINCHOS,13106,3,-33.466213,-70.708466,36,1,10
26197,ESCUELA DE PARV. LOS CARIÑOSITOS,13404,2,-33.817055,-70.73619,60,1,10
26200,ESCUELA DE PARV. PUDU,13119,2,-33.514816,-70.771065,46,1,10
26201,COLEGIO DE AD. EDUCAP,13119,2,-33.539066,-70.77792,374,1,165
26202,ESCUELA ESP. MI MUNDO EN PALABRAS DE BUIN,13402,2,-33.72698599999999,-70.77439,336,1,10
26209,COLEGIO SAN JUAN DIEGO DE GUADALUPE,13119,2,-33.51159078,-70.79701194,502,1,110
26214,CENTRO DE EDUCACIÓN DE ADULTOS BERNARDO O´HIGGINS DE MAIPÚ,13119,2,-33.50951,-70.76327,241,1,363
26216,ESCUELA DE PARV. MUSICAL GARFIELD,13128,2,-33.405613,-70.727295,47,1,10
26219,CENTRO EDUC. GOYENECHEA,13128,2,-33.40656652,-70.73691622,671,1,10
26221,ESCUELA DE PARV. TIO RICO,13110,2,-33.55445499999999,-70.56821,57,1,10
26222,ESCUELA ESP. SANTA MARIA DE EL BOSQUE,13105,2,-33.57278,-70.689316,133,1,214
26223,ESCUELA DE PARVULOS PIECESITOS DE NINOS,13110,2,-33.558163,-70.57517,5,1,10
26224,ESCUELA ESP. CANTOS NUEVOS,13106,2,-33.471806,-70.72022,150,1,214
26225,COLEGIO DE ADULTOS ROCKET,13118,2,-33.48053999999999,-70.58873,196,1,165
26226,ESCUELA DE PARV. ARMONIA,13110,2,-33.54611599999999,-70.59479,9,1,10
26227,ESCUELA ESP. ARCA DE LOS NIÑOS,13131,2,-33.52135,-70.6447,117,1,214
26228,ESCUELA BAS. ECHAURREN N° 2,13119,2,-33.47750005999999,-70.73899872,310,1,10
26230,ESCUELA ESP. SOL NACIENTE,13109,2,-33.52225,-70.64666,84,1,214
26231,ESCUELA ESP. ALEGRIA DE NIÑOS,13112,2,-33.585575,-70.658295,54,1,214
26235,ESCUELA BASICA PARTICULAR PAICAVI DE LAMPA,13302,2,-33.28710515,-70.87739588,300,1,10
26236,ESCUELA ESP. DIVERSIDAD,13110,2,-33.52126299999999,-70.564995,123,1,212
26237,ESCUELA ESPECIAL AGORA,13103,2,-33.42759,-70.72036,142,1,212
26238,COLEGIO DEL VERBO DIVINO DE CHICUREO,13301,3,-33.287838,-70.67051,759,1,10
26239,ESCUELA DE PARV. Y ESP. AMANECER DE EL BOSQUE,13105,2,-33.571716,-70.671486,395,1,10
26240,ESCUELA ESPECIAL SEMILLITAS DE EL BOSQUE,13105,2,-33.56288,-70.68,45,1,10
26241,ESCUELA ESP. SAN CLEMENTE DE HUECHURABA,13107,2,-33.340954,-70.67053,180,1,214
26243,ESCUELA ESP. SAN CARLOS DE MELIPILLA,13501,2,-33.681465,-71.20134,187,1,10
26244,ESCUELA BAS. SAN ESTEBAN DE MELIPILLA,13501,2,-33.6905,-71.20048,251,1,10
26245,ESCUELA BAS. CRISTIANO EL SEMBRADOR,13104,2,-33.37540514,-70.68134046,339,1,10
26246,ESCUELA ESP. PROFESORA ELSA BENITEZ,13128,2,-33.40348,-70.73601,178,1,214
26249,ESCUELA BASICA MIRAFLORES DE LAMPA,13302,2,-33.2770117,-70.87845924,298,1,10
26250,ESCUELA BAS. MISIONERO DE AGOSTINI,13112,2,-33.62627936,-70.62861516,243,1,10
26252,ESCUELA ESP. SAN BERNARDO,13401,2,-33.606495,-70.71209,169,1,212
26254,COLEGIO SANTA MARIA GORETTI DE PADRE HUR,13604,2,-33.56367887999999,-70.79833526,579,1,10
26255,ESCUELA ESP. CLEMENTE DE JESUS,13105,2,-33.55097,-70.68467,40,1,212
26256,ESCUELA ESP. PLAZUELA ENCANTADA,13201,2,-33.56302,-70.56221,76,1,214
26257,ESCUELA ESP. FLORECER,13501,2,-33.68193,-71.20849,214,1,10
26258,ESCUELA DE PARV. HEIDI DE LO ESPEJO,13116,2,-33.505096,-70.690384,38,1,10
26259,ESCUELA ESP. ANTOBEL,13110,2,-33.548996,-70.58687,69,1,212
26260,LINCOLN COLLEGE PUDAHUEL,13124,2,-33.45355185999999,-70.76140566,1722,1,10
26261,ESCUELA ESP. SANTA CATALINA DE TALAGANTE,13601,2,-33.66861999999999,-70.93559,41,1,214
26262,CENTRO EDUC. ESPECIAL HANS ASPERGER,13110,2,-33.524403,-70.603745,37,1,217
26263,ESCUELA ESP. EL PALACIO DE LOS NIÑOS DE SAN B,13401,2,-33.604267,-70.69907,199,1,212
26264,ESCUELA ESP. SEMILLITA DE RECOLETA,13127,2,-33.38803999999999,-70.64905,294,1,214
26267,ESCUELA ESP. RUCA RAYEN,13113,2,-33.452213,-70.530106,16,1,217
26268,COLEGIO SAINT LOUIS SCHOOL,13119,3,-33.56282568999999,-70.7739562,645,1,10
26269,COLEGIO ALTO DEL VALLE,13402,2,-33.73157859,-70.77296766,1045,1,10
26270,ESCUELA ESP. ARCOIRIS DE BUIN,13402,2,-33.732025,-70.78363,108,1,10
26271,ESCUELA BAS. VALLE VERDE,13301,2,-33.18106062999999,-70.67153235,272,1,10
26272,COLEGIO WESTON ACADEMY,13125,3,-33.36366419,-70.73019933,816,1,10
